lightllm/common/triton_utils/autotune_kernel_configs/triton_3.6.0/NVIDIA_H200/moe_align_fused_atomic:v1/{expert_num=257,topk_num=9}_NVIDIA_H200.json
{
  "1024": {
    "BLOCK_SIZE": 128,
    "num_warps": 8
  },
  "16384": {
    "BLOCK_SIZE": 128,
    "num_warps": 4
  },
  "2048": {
    "BLOCK_SIZE": 128,
    "num_warps": 4
  },
  "256": {
    "BLOCK_SIZE": 128,
    "num_warps": 4
  },
  "4096": {
    "BLOCK_SIZE": 128,
    "num_warps": 4
  }
}