lightllm/common/triton_utils/autotune_kernel_configs/triton_3.6.0/NVIDIA_H800/fused_gdn_gating:v1/{NUM_HEADS=12,a_dtype=torch.bfloat16}_NVIDIA_H800.json
{
  "1": {
    "BLK_HEADS": 64,
    "num_warps": 4
  },
  "100": {
    "BLK_HEADS": 64,
    "num_warps": 4
  },
  "1024": {
    "BLK_HEADS": 16,
    "num_warps": 2
  },
  "128": {
    "BLK_HEADS": 16,
    "num_warps": 2
  },
  "16": {
    "BLK_HEADS": 64,
    "num_warps": 4
  },
  "2048": {
    "BLK_HEADS": 16,
    "num_warps": 2
  },
  "256": {
    "BLK_HEADS": 64,
    "num_warps": 4
  },
  "32": {
    "BLK_HEADS": 16,
    "num_warps": 2
  },
  "4096": {
    "BLK_HEADS": 16,
    "num_warps": 2
  },
  "64": {
    "BLK_HEADS": 64,
    "num_warps": 4
  },
  "8": {
    "BLK_HEADS": 16,
    "num_warps": 2
  },
  "8192": {
    "BLK_HEADS": 32,
    "num_warps": 4
  }
}