lightllm/common/triton_utils/autotune_kernel_configs/triton_3.6.0/NVIDIA_H800/fused_gdn_gating:v1/{NUM_HEADS=6,a_dtype=torch.bfloat16}_NVIDIA_H800.json
{
  "1": {
    "BLK_HEADS": 16,
    "num_warps": 1
  },
  "100": {
    "BLK_HEADS": 64,
    "num_warps": 2
  },
  "1024": {
    "BLK_HEADS": 64,
    "num_warps": 2
  },
  "128": {
    "BLK_HEADS": 16,
    "num_warps": 1
  },
  "16": {
    "BLK_HEADS": 64,
    "num_warps": 1
  },
  "16384": {
    "BLK_HEADS": 16,
    "num_warps": 1
  },
  "2048": {
    "BLK_HEADS": 64,
    "num_warps": 2
  },
  "256": {
    "BLK_HEADS": 64,
    "num_warps": 1
  },
  "32": {
    "BLK_HEADS": 16,
    "num_warps": 1
  },
  "4096": {
    "BLK_HEADS": 16,
    "num_warps": 1
  },
  "64": {
    "BLK_HEADS": 16,
    "num_warps": 1
  },
  "8": {
    "BLK_HEADS": 16,
    "num_warps": 1
  },
  "8192": {
    "BLK_HEADS": 64,
    "num_warps": 2
  }
}