lightllm/common/triton_utils/autotune_kernel_configs/triton_3.5.1/NVIDIA_H200/silu_and_mul_fwd:v1/{N=704,out_dtype=torch.bfloat16}_NVIDIA_H200.json
{
  "1024": {
    "BLOCK_M": 8,
    "BLOCK_N": 256,
    "NUM_STAGES": 4,
    "num_warps": 1
  },
  "128": {
    "BLOCK_M": 1,
    "BLOCK_N": 256,
    "NUM_STAGES": 1,
    "num_warps": 4
  },
  "16384": {
    "BLOCK_M": 1,
    "BLOCK_N": 256,
    "NUM_STAGES": 4,
    "num_warps": 1
  },
  "2048": {
    "BLOCK_M": 8,
    "BLOCK_N": 256,
    "NUM_STAGES": 1,
    "num_warps": 4
  },
  "256": {
    "BLOCK_M": 1,
    "BLOCK_N": 256,
    "NUM_STAGES": 1,
    "num_warps": 4
  },
  "32768": {
    "BLOCK_M": 1,
    "BLOCK_N": 256,
    "NUM_STAGES": 4,
    "num_warps": 1
  },
  "512": {
    "BLOCK_M": 1,
    "BLOCK_N": 256,
    "NUM_STAGES": 1,
    "num_warps": 1
  },
  "64": {
    "BLOCK_M": 1,
    "BLOCK_N": 256,
    "NUM_STAGES": 1,
    "num_warps": 4
  },
  "65536": {
    "BLOCK_M": 8,
    "BLOCK_N": 256,
    "NUM_STAGES": 4,
    "num_warps": 1
  },
  "8": {
    "BLOCK_M": 1,
    "BLOCK_N": 128,
    "NUM_STAGES": 1,
    "num_warps": 1
  },
  "800": {
    "BLOCK_M": 1,
    "BLOCK_N": 256,
    "NUM_STAGES": 1,
    "num_warps": 4
  },
  "8192": {
    "BLOCK_M": 8,
    "BLOCK_N": 256,
    "NUM_STAGES": 4,
    "num_warps": 1
  }
}