lightllm/common/triton_utils/autotune_kernel_configs/triton_3.6.0/NVIDIA_H800/add_rmsnorm_forward:v1/{N=5120,has_weight=true,out_dtype=torch.bfloat16,weight_dtype=torch.bfloat16,x_dtype=torch.bfloat16}_NVIDIA_H800.json
{
  "1": {
    "num_warps": 8
  },
  "128": {
    "num_warps": 8
  },
  "16": {
    "num_warps": 8
  },
  "2": {
    "num_warps": 8
  },
  "256": {
    "num_warps": 16
  },
  "32": {
    "num_warps": 8
  },
  "4": {
    "num_warps": 8
  },
  "512": {
    "num_warps": 8
  },
  "64": {
    "num_warps": 8
  },
  "8": {
    "num_warps": 8
  }
}