lightllm/common/triton_utils/autotune_kernel_configs/triton_3.5.1/NVIDIA_H100_80GB_HBM3/add_rmsnorm_forward:v1/{N=5120,has_weight=true,out_dtype=torch.bfloat16,weight_dtype=torch.bfloat16,x_dtype=torch.bfloat16}_NVIDIA_H100_80GB_HBM3.json
{
  "1": {
    "num_warps": 16
  },
  "128": {
    "num_warps": 4
  },
  "16": {
    "num_warps": 4
  },
  "2": {
    "num_warps": 4
  },
  "256": {
    "num_warps": 16
  },
  "32": {
    "num_warps": 16
  },
  "4": {
    "num_warps": 16
  },
  "64": {
    "num_warps": 16
  },
  "8": {
    "num_warps": 16
  }
}