lightllm/common/triton_utils/autotune_kernel_configs/triton_3.5.1/NVIDIA_H200/moe_sum_reduce:v1/{hidden_dim=2816,out_dtype=torch.bfloat16,topk_num=8}_NVIDIA_H200.json
{
  "1": {
    "BLOCK_DIM": 256,
    "BLOCK_M": 1,
    "NUM_STAGE": 2,
    "num_warps": 8
  },
  "100": {
    "BLOCK_DIM": 512,
    "BLOCK_M": 1,
    "NUM_STAGE": 1,
    "num_warps": 4
  },
  "1024": {
    "BLOCK_DIM": 256,
    "BLOCK_M": 1,
    "NUM_STAGE": 1,
    "num_warps": 2
  },
  "128": {
    "BLOCK_DIM": 1024,
    "BLOCK_M": 1,
    "NUM_STAGE": 1,
    "num_warps": 8
  },
  "16": {
    "BLOCK_DIM": 256,
    "BLOCK_M": 1,
    "NUM_STAGE": 1,
    "num_warps": 8
  },
  "2048": {
    "BLOCK_DIM": 1024,
    "BLOCK_M": 1,
    "NUM_STAGE": 1,
    "num_warps": 8
  },
  "256": {
    "BLOCK_DIM": 1024,
    "BLOCK_M": 1,
    "NUM_STAGE": 1,
    "num_warps": 8
  },
  "32": {
    "BLOCK_DIM": 256,
    "BLOCK_M": 1,
    "NUM_STAGE": 4,
    "num_warps": 8
  },
  "4096": {
    "BLOCK_DIM": 512,
    "BLOCK_M": 1,
    "NUM_STAGE": 4,
    "num_warps": 1
  },
  "64": {
    "BLOCK_DIM": 1024,
    "BLOCK_M": 1,
    "NUM_STAGE": 1,
    "num_warps": 8
  },
  "8": {
    "BLOCK_DIM": 256,
    "BLOCK_M": 1,
    "NUM_STAGE": 2,
    "num_warps": 8
  },
  "8192": {
    "BLOCK_DIM": 1024,
    "BLOCK_M": 1,
    "NUM_STAGE": 1,
    "num_warps": 8
  }
}