lightllm/common/triton_utils/autotune_kernel_configs/triton_3.5.1/NVIDIA_H100_80GB_HBM3/gated_rmsnorm_forward:v1/{N=128,has_bias=false,weight_dtype=torch.bfloat16,x_dtype=torch.bfloat16}_NVIDIA_H100_80GB_HBM3.json
{
  "1024": {
    "BLOCK_N": 64,
    "num_warps": 2
  },
  "12": {
    "BLOCK_N": 128,
    "num_warps": 1
  },
  "1200": {
    "BLOCK_N": 256,
    "num_warps": 2
  },
  "12288": {
    "BLOCK_N": 128,
    "num_warps": 1
  },
  "128": {
    "BLOCK_N": 256,
    "num_warps": 8
  },
  "131072": {
    "BLOCK_N": 64,
    "num_warps": 2
  },
  "1536": {
    "BLOCK_N": 128,
    "num_warps": 1
  },
  "16": {
    "BLOCK_N": 64,
    "num_warps": 2
  },
  "1600": {
    "BLOCK_N": 64,
    "num_warps": 1
  },
  "16384": {
    "BLOCK_N": 128,
    "num_warps": 1
  },
  "192": {
    "BLOCK_N": 512,
    "num_warps": 1
  },
  "196608": {
    "BLOCK_N": 128,
    "num_warps": 1
  },
  "2048": {
    "BLOCK_N": 64,
    "num_warps": 1
  },
  "24576": {
    "BLOCK_N": 64,
    "num_warps": 1
  },
  "256": {
    "BLOCK_N": 128,
    "num_warps": 1
  },
  "262144": {
    "BLOCK_N": 64,
    "num_warps": 2
  },
  "3072": {
    "BLOCK_N": 256,
    "num_warps": 2
  },
  "32768": {
    "BLOCK_N": 128,
    "num_warps": 1
  },
  "384": {
    "BLOCK_N": 512,
    "num_warps": 2
  },
  "4096": {
    "BLOCK_N": 256,
    "num_warps": 1
  },
  "49152": {
    "BLOCK_N": 64,
    "num_warps": 2
  },
  "512": {
    "BLOCK_N": 64,
    "num_warps": 2
  },
  "64": {
    "BLOCK_N": 256,
    "num_warps": 8
  },
  "65536": {
    "BLOCK_N": 128,
    "num_warps": 1
  },
  "768": {
    "BLOCK_N": 256,
    "num_warps": 2
  },
  "8": {
    "BLOCK_N": 64,
    "num_warps": 2
  },
  "800": {
    "BLOCK_N": 64,
    "num_warps": 2
  },
  "8192": {
    "BLOCK_N": 256,
    "num_warps": 1
  },
  "96": {
    "BLOCK_N": 512,
    "num_warps": 2
  },
  "98304": {
    "BLOCK_N": 256,
    "num_warps": 1
  }
}