lightllm/common/triton_utils/autotune_kernel_configs/triton_3.6.0/NVIDIA_H800/chunk_local_cumsum_scalar/{B=1,BT=64,H=6,IS_VARLEN=true,REVERSE=false}_NVIDIA_H800.json
{
  "1": {
    "num_warps": 4
  },
  "100": {
    "num_warps": 4
  },
  "1024": {
    "num_warps": 1
  },
  "128": {
    "num_warps": 1
  },
  "16": {
    "num_warps": 1
  },
  "16384": {
    "num_warps": 2
  },
  "2048": {
    "num_warps": 8
  },
  "256": {
    "num_warps": 8
  },
  "32": {
    "num_warps": 4
  },
  "4096": {
    "num_warps": 4
  },
  "64": {
    "num_warps": 1
  },
  "8": {
    "num_warps": 4
  },
  "8192": {
    "num_warps": 4
  }
}