lightllm/common/triton_utils/autotune_kernel_configs/triton_3.6.0/NVIDIA_H800/gated_rmsnorm_forward:v1/{N=128,has_bias=false,weight_dtype=torch.bfloat16,x_dtype=torch.bfloat16}_NVIDIA_H800.json
{
  "12": {
    "BLOCK_N": 128,
    "num_warps": 1
  },
  "1200": {
    "BLOCK_N": 128,
    "num_warps": 1
  },
  "12288": {
    "BLOCK_N": 256,
    "num_warps": 1
  },
  "1536": {
    "BLOCK_N": 128,
    "num_warps": 1
  },
  "192": {
    "BLOCK_N": 128,
    "num_warps": 1
  },
  "24576": {
    "BLOCK_N": 128,
    "num_warps": 1
  },
  "3072": {
    "BLOCK_N": 128,
    "num_warps": 1
  },
  "384": {
    "BLOCK_N": 128,
    "num_warps": 1
  },
  "48": {
    "BLOCK_N": 256,
    "num_warps": 1
  },
  "49152": {
    "BLOCK_N": 128,
    "num_warps": 1
  },
  "6": {
    "BLOCK_N": 256,
    "num_warps": 1
  },
  "600": {
    "BLOCK_N": 64,
    "num_warps": 1
  },
  "6144": {
    "BLOCK_N": 64,
    "num_warps": 1
  },
  "768": {
    "BLOCK_N": 64,
    "num_warps": 2
  },
  "96": {
    "BLOCK_N": 256,
    "num_warps": 8
  },
  "98304": {
    "BLOCK_N": 128,
    "num_warps": 1
  }
}