lightllm/common/triton_utils/autotune_kernel_configs/triton_3.5.1/NVIDIA_H100_80GB_HBM3/mrope_triton_fused:v1/{HEAD_DIM=256,K_HEAD_NUM=1,Q_HEAD_NUM=4,dtype=torch.bfloat16}_NVIDIA_H100_80GB_HBM3.json
{
  "1": {
    "num_stages": 1,
    "num_warps": 8
  },
  "100": {
    "num_stages": 4,
    "num_warps": 2
  },
  "1024": {
    "num_stages": 4,
    "num_warps": 1
  },
  "128": {
    "num_stages": 4,
    "num_warps": 2
  },
  "16": {
    "num_stages": 4,
    "num_warps": 1
  },
  "16384": {
    "num_stages": 4,
    "num_warps": 1
  },
  "2048": {
    "num_stages": 1,
    "num_warps": 2
  },
  "256": {
    "num_stages": 4,
    "num_warps": 2
  },
  "32": {
    "num_stages": 1,
    "num_warps": 2
  },
  "4096": {
    "num_stages": 4,
    "num_warps": 4
  },
  "64": {
    "num_stages": 4,
    "num_warps": 1
  },
  "8": {
    "num_stages": 1,
    "num_warps": 8
  }
}